conceptType,conceptUri,preferredLabel,status,skillType,reuseLevel,altLabels,description,broaderConceptUri,broaderConceptPT
KnowledgeSkillCompetence,http://data.europa.eu/esco/skill/a9c1a772-8ef6-4dd7-93a4-c6bbf3293688,vastuuntuntoista kalastusta koskevat säännöt,released,knowledge,cross-sector,vastuuntuntoista kalastusta koskevat menettelyohjeet,Yhdistyneiden kansakuntien elintarvike- ja maatalousjärjestön (FAO) vastuuntuntoista kalastusta koskevat säännöt ja ammattikalastajia koskevat suuntaviivat.,http://data.europa.eu/esco/isced-f/0831,kalatalous
KnowledgeSkillCompetence,http://data.europa.eu/esco/skill/aaa84f7f-4006-4d9b-81e0-e8eeacdde025,tehdä toteutettavuustutkimus biokaasuenergiasta,released,skill/competence,sector-specific,,"Arvioida jätteestä tuotettavan biokaasun potentiaalia. Toteuttaa standardoitu tutkimus, jotta voidaan arvioida omistamiseen liittyvät kokonaiskustannukset sekä tämän energiamuodon käyttämisen hyvät ja huonot puolet, ja tehdä tutkimusta päätöksenteon tueksi.
	",http://data.europa.eu/esco/skill/ec528c47-65f4-4187-9dc1-5a8889f84a06 | http://data.europa.eu/esco/skill/d74df140-eb69-43e2-bac9-1cafc824d702,analysoida liiketoimintaa | tehdä kannattavuustutkimus
KnowledgeSkillCompetence,http://data.europa.eu/esco/skill/aac9e93a-106a-4cdc-8d27-ac3a9ffce0ac,kansainvälinen yleissopimus aluksista aiheutuvan meren pilaantumisen ehkäisemisestä,released,knowledge,cross-sector,MARPOL,"Aluksista aiheutuvan meren pilaantumisen ehkäisemisestä tehdyssä kansainvälisessä yleissopimuksessa (MARPOL) säädetyt perusperiaatteet ja -vaatimukset: öljyn aiheuttaman meren pilaantumisen ehkäisemistä koskevat määräykset, irtolastina kuljetettavien haitallisten nestemäisten aineiden aiheuttamaa pilaantumista koskevat määräykset, merellä pakattuina kuljetettavien haitallisten aineiden aiheuttaman meren pilaantumisen ehkäisy, alusten jätteiden aiheuttaman meren pilaantumisen ehkäisy, alusten roskien aiheuttaman ilman pilaantumisen ehkäisy, alusten aiheuttaman ilman pilaantumisen ehkäisy.",http://data.europa.eu/esco/isced-f/0421 | http://data.europa.eu/esco/skill/243ffeb4-3395-4e39-9cf0-695be5b142aa,oikeustieteet | merioikeus
KnowledgeSkillCompetence,http://data.europa.eu/esco/skill/aadf267e-08f0-4bf3-ae4a-f1670b8e9e5d,merienergiateknologiat,released,knowledge,sector-specific,,"Eri teknologiat, joilla lisätään valtamerienergian käyttöönottoa. Tällaisia ovat esimerkiksi tuuli-, aalto- ja vuorovesiturbiinit, kelluvat aurinkosähkölaitokset, suolapitoisuuden eroa hyödyntävät generaattorit ja meren lämpöenergian muuntaminen (OTEC).
	",http://data.europa.eu/esco/isced-f/0713,sähkö ja energia
KnowledgeSkillCompetence,http://data.europa.eu/esco/skill/ab0deac2-b872-45c8-ad65-657938d2fe79,aurinkolämpöjärjestelmät lämmintä vettä ja lämmitystä varten,released,knowledge,sector-specific,,"Putken muotoisten aurinkokeräinjärjestelmien käyttö lämpimän käyttöveden ja lämmityksen tuottamiseen ja varastointiin ja niiden panos energiatehokkuuteen.
	",http://data.europa.eu/esco/isced-f/0713,sähkö ja energia
KnowledgeSkillCompetence,http://data.europa.eu/esco/skill/ae6d655d-bbce-4701-ba04-d687cfa90eda,suojella biologista monimuotoisuutta,released,skill/competence,sector-specific,,"Suojella eläinten, kasvien ja mikro-organismien biologista monimuotoisuutta ottamalla käyttöön ympäristön kannalta kestäviä toimia, kuten ylläpitämällä luontotyyppejä ja suojelemalla luontoa.
	",http://data.europa.eu/esco/skill/d168d98c-b7bb-4b9a-b1dc-eac008af4df3 | http://data.europa.eu/esco/skill/8064ae65-5d1b-44e1-9aaf-246a4285a9a6,toteuttaa biodiversiteettiä koskevia toimintasuunnitelmia | noudattaa ympäristönsuojelulakeja ja -normeja
KnowledgeSkillCompetence,http://data.europa.eu/esco/skill/aeb400b6-d38c-45cc-9252-3c6983c614bb,suorittaa ekologisia kenttätutkimuksia,released,skill/competence,sector-specific,,"Toteuttaa kenttätutkimuksia, joilla kerätään tietoja organismien lukumäärästä ja jakautumisesta.",http://data.europa.eu/esco/skill/7eafec38-621a-4b6e-9298-bfe70ec0b253,tehdä akateemista tutkimusta tai markkinatutkimusta
KnowledgeSkillCompetence,http://data.europa.eu/esco/skill/afdcb380-ef9f-4785-b877-cc551f035034,agronomia,released,knowledge,cross-sector,maataloustiede,"Tieteenala, joka tutkii luonnonympäristön suojelua ja uudistamista maataloudessa. Siihen sisältyvät periaatteet ja menetelmät, jotka koskevat maatalouden kestävyyden kannalta tärkeitä valintoja ja asianmukaisia soveltamismenetelmiä.",http://data.europa.eu/esco/isced-f/0811,maanviljely ja kotieläintalous
KnowledgeSkillCompetence,http://data.europa.eu/esco/skill/affb720b-98e7-4ae6-b833-b12e94fa8987,hydroponinen viljely,released,knowledge,sector-specific,,"Kasvien viljely ilman multaa ravinneliuosta käyttämällä.
   ",http://data.europa.eu/esco/isced-f/0812,puutarhanhoito
KnowledgeSkillCompetence,http://data.europa.eu/esco/skill/b013ae1f-5efc-42b5-8dab-8a8add39bbd8,valvoa polttoaineiden varastointimääräyksiä,released,skill/competence,sector-specific,valvoa polttoaineiden varastointimääräysten noudattamista,Polttoaineiden varastointimääräyksien valvominen lakisäänteisten ja ympäristöä koskevien käytäntöjen ja määräysten mukaisesti.,http://data.europa.eu/esco/skill/802deca0-b880-4d1a-b366-e13b27621baf,noudattaa toimintaohjeita
KnowledgeSkillCompetence,http://data.europa.eu/esco/skill/b09df20a-51b9-438d-9745-696b02156470,käsitellä jätteitä,released,skill/competence,cross-sector,,Biojätteiden ja kemiallisten jätteiden säännösten mukainen käsittely ja hävittäminen.,http://data.europa.eu/esco/skill/f8c676de-c871-424f-9a65-77059d07910a,käsitellä ja hävittää jätteitä ja vaarallisia materiaaleja
KnowledgeSkillCompetence,http://data.europa.eu/esco/skill/b115cabc-c030-45b2-ac8e-922d45716183,biomassan muuttaminen,released,knowledge,sector-specific,biomassan jalostus | biomassan jalostaminen,"Muuntoprosessi, jossa biologisista aineista tehdään joko lämpöä polttamalla tai biopolttoainetta kemiallisten, termisten ja biokemiallisten menetelmien avulla.",http://data.europa.eu/esco/skill/609d6bb4-db16-4578-87fc-57b11a701cc2 | http://data.europa.eu/esco/isced-f/0512,biotalous | biokemia
KnowledgeSkillCompetence,http://data.europa.eu/esco/skill/b13e0689-636d-42d0-86c3-df9d6f85a882,huolehtia ympäristöjärjestelmästä,released,skill/competence,cross-sector,,Ympäristöjärjestelmän kehittäminen ja toteutus.,http://data.europa.eu/esco/skill/8064ae65-5d1b-44e1-9aaf-246a4285a9a6 | http://data.europa.eu/esco/skill/4c3ab565-747c-4db3-8c47-79e8d6f98cf4,noudattaa ympäristönsuojelulakeja ja -normeja | ottaa käyttöön tapoja kulutuksen kielteisen vaikutuksen vähentämiseksi
KnowledgeSkillCompetence,http://data.europa.eu/esco/skill/b1b118c4-3291-484e-b64d-6d51fd5da8b3,ympäristöteknologia,released,knowledge,cross-sector,ympäristötekniikka,"Ympäristön ja kestävän kehityksen parantamiseen tähtäävien tieteellisten ja teknisten teorioiden ja periaatteiden soveltaminen pilaantuneen ympäristön kunnostamiseen, kestävän energian kehittämiseen sekä jätehuollon ja jätteiden vähentämiseen. Esimerkiksi ympäristöystävällisten peruspalveluiden (kuten ilman, veden ja maan) tarjoaminen ihmisille ja muille organismeille.",http://data.europa.eu/esco/isced-f/0712,ympäristönsuojeluteknologia
KnowledgeSkillCompetence,http://data.europa.eu/esco/skill/b21072bc-7c50-4ec7-a822-5233e9363b53,valmistetun eläinrehun ja lemmikkieläinten ruoan pilaantumisriskit,released,knowledge,sector-specific,valmistetun eläinrehun ja lemmikkieläinten ruoan kontaminaatioriskit,Eläinrehuihin liittyvät kontaminaation ja pilaantumisen vaarat. Ennaltaehkäisy ja reagointi.,http://data.europa.eu/esco/isced-f/0811,maanviljely ja kotieläintalous
KnowledgeSkillCompetence,http://data.europa.eu/esco/skill/b251544f-7b92-46d5-8e14-97f59ce1c7dc,edistää innovatiivisten infrastruktuurien suunnittelua,released,skill/competence,sector-specific,,"Innovatiivisten ja kestävän infrastruktuurin suunnittelun edistäminen kaikissa rakennusprojektin vaiheissa sekä sen varmistaminen, että projektissa otetaan huomioon alan uusin kehitys.",http://data.europa.eu/esco/skill/b2c688b0-9106-466d-8b88-eafdfe608e7d,suunnitella rakenteita tai tiloja
KnowledgeSkillCompetence,http://data.europa.eu/esco/skill/b25c3eb8-fd63-4d77-8308-7061dbd271c1,suojella luonnonvaroja,released,skill/competence,sector-specific,,Vesien ja luonnonvarojen suojeleminen ja suojelutoimien koordinointi. Yhteistyö ympäristövirastojen ja resurssienhallintahenkilöstön kanssa.,http://data.europa.eu/esco/skill/8064ae65-5d1b-44e1-9aaf-246a4285a9a6,noudattaa ympäristönsuojelulakeja ja -normeja
KnowledgeSkillCompetence,http://data.europa.eu/esco/skill/b2b970ad-0276-4069-ba31-899a53191b95,biosuodatinjärjestelmät,released,knowledge,occupation-specific,biologiset suodatusjärjestelmät,"Tekniikat, joilla ehkäistään pilaantumista biosuodatusprosessien avulla.",http://data.europa.eu/esco/isced-f/0712,ympäristönsuojeluteknologia
KnowledgeSkillCompetence,http://data.europa.eu/esco/skill/b2f05068-c409-43ec-ba58-b5dfe991ca5e,antaa yrityksen yhteiskuntavastuuseen liittyviä neuvoja,released,skill/competence,occupation-specific,,"Yrityksen ja organisaatioiden yhteiskuntavastuusta tiedottaminen sekä neuvojen antaminen kestävästä kehityksestä.
	",http://data.europa.eu/esco/skill/062a9fde-cd91-44f9-9a2f-9e2bc3b281fd,neuvoa ympäristökysymyksissä
KnowledgeSkillCompetence,http://data.europa.eu/esco/skill/b30c2dd2-996c-4984-9c68-ce05bf26f1e1,kouluttaa henkilökuntaa kierrätysohjelmista,released,skill/competence,cross-sector,,"Henkilökunnan kouluttaminen yrityksen käytettävissä olevista kierrätysmenetelmistä ja -ohjelmista sekä muista yrityksen menettelyistä ja käytännöistä, jotka on otettava huomioon.",http://data.europa.eu/esco/skill/9601b2a8-68e4-4906-9306-a23679b8f0b0 | http://data.europa.eu/esco/skill/6c4fa8c8-e9e1-49b5-897f-6b61fe649488 | http://data.europa.eu/esco/skill/699e7c26-6502-4e78-a823-3656ff5a5b8b,valvoa henkilöstöä | opettaa operatiivisia menettelyjä | opettaa muita
KnowledgeSkillCompetence,http://data.europa.eu/esco/skill/b34f8562-9fcc-4e58-bd1c-8088ebadd315,antaa luonnonsuojeluun liittyviä neuvoja,released,skill/competence,sector-specific,,Luonnonsuojeluun liittyvien tietojen ja ehdotettujen toimintatapojen antaminen.,http://data.europa.eu/esco/skill/062a9fde-cd91-44f9-9a2f-9e2bc3b281fd | http://data.europa.eu/esco/skill/045f71e6-0699-4169-8a54-9c6b96f3174d,neuvoa ympäristökysymyksissä | neuvoa muita
KnowledgeSkillCompetence,http://data.europa.eu/esco/skill/b422efe7-b151-4120-86ae-db11a48dd0fa,antaa neuvoja ympäristön kunnostuksesta,released,skill/competence,cross-sector,,"Neuvojen antaminen sellaisten toimien kehittämisestä ja toteutuksesta, joilla pyritään poistamaan ympäristön pilaantumiseen ja saastumiseen vaikuttavat tekijät.",http://data.europa.eu/esco/skill/062a9fde-cd91-44f9-9a2f-9e2bc3b281fd | http://data.europa.eu/esco/skill/045f71e6-0699-4169-8a54-9c6b96f3174d,neuvoa ympäristökysymyksissä | neuvoa muita
KnowledgeSkillCompetence,http://data.europa.eu/esco/skill/b4bd4b00-be51-4631-b202-dcb0e33c0899,suojella riistaa,released,skill/competence,occupation-specific,,Luvattoman metsästyksen estäminen partioimalla alueella yöllä.,http://data.europa.eu/esco/skill/8064ae65-5d1b-44e1-9aaf-246a4285a9a6,noudattaa ympäristönsuojelulakeja ja -normeja
KnowledgeSkillCompetence,http://data.europa.eu/esco/skill/b4db1a85-2488-4dc9-bd53-3dcb3f9deac7,lannoittamisen periaatteet,released,knowledge,cross-sector,,"Kasvien, maaperän rakenteen sekä ilmaston ja ympäristön suojelun tutkimus viljelytuotannossa.",http://data.europa.eu/esco/isced-f/0811,maanviljely ja kotieläintalous
KnowledgeSkillCompetence,http://data.europa.eu/esco/skill/b552832c-ad26-4901-b76c-232a53c74aba,koordinoida sähkön tuotantoa,released,skill/competence,sector-specific,,"Sähköntuotannon tarpeen ilmoittaminen työntekijöille sekä voimalaitoksille sen varmistamiseksi, että sähköntuotantoa voidaan lisätä tai vähentää vastaavasti.",http://data.europa.eu/esco/skill/75d8e5d9-bef3-418b-9011-01bff9f27207 | http://data.europa.eu/esco/skill/a19c5139-1250-4a60-9c31-a3243cca06cc,johtaa muita | viestiä työtovereiden ja asiakkaiden kanssa
KnowledgeSkillCompetence,http://data.europa.eu/esco/skill/b55376e1-41c3-45f8-9b35-d3e7b1288a33,arvioida ajoneuvon ekologinen jalanjälki,released,skill/competence,sector-specific,,"Arvioida ajoneuvojen ekologista jalanjälkeä ja käyttää eri menetelmiä kasvihuonekaasupäästöjen, kuten hiilidioksidipäästöjen, analysoimiseksi.
	",http://data.europa.eu/esco/skill/f7fc7bf8-f41d-44af-81e3-09b88e9779e6,testata sähköisiä ja mekaanisia järjestelmiä ja laitteita
KnowledgeSkillCompetence,http://data.europa.eu/esco/skill/b589ce7c-588f-4045-be2d-9332c2d2278d,pintakäsittelytekniikka,released,knowledge,cross-sector,,"Insinööritieteen ala, joka selvittää, miten ympäristön aiheuttamia haittoja, kuten korroosiota ja pintamateriaalin pilaantumista, voidaan torjua esimerkiksi muuttamalla pintojen ominaisuuksia ja tekemällä niistä käyttöympäristöään sietäviä.",http://data.europa.eu/esco/isced-f/0712 | http://data.europa.eu/esco/skill/b1b118c4-3291-484e-b64d-6d51fd5da8b3,ympäristönsuojeluteknologia | ympäristöteknologia
KnowledgeSkillCompetence,http://data.europa.eu/esco/skill/b71fc6e4-14eb-488b-9f26-a7c15fd6d6e8,tehdä toteutettavuustutkimus geotermisestä energiasta,released,skill/competence,sector-specific,,"Arvioida geotermisen energiajärjestelmän potentiaalia. Toteuttaa standardoitu tutkimus, jotta voidaan määrittää kustannukset, rajoitukset ja saatavilla olevat komponentit, ja tehdä tutkimusta päätöksenteon tueksi. Selvittää paras järjestelmätyyppi käytettävissä olevan lämpöpumpputyypin yhteydessä.
	",http://data.europa.eu/esco/skill/d74df140-eb69-43e2-bac9-1cafc824d702 | http://data.europa.eu/esco/skill/ec528c47-65f4-4187-9dc1-5a8889f84a06,tehdä kannattavuustutkimus | analysoida liiketoimintaa
KnowledgeSkillCompetence,http://data.europa.eu/esco/skill/b7a26b32-c457-49aa-9a78-25ade10090e3,huoltaa tuuliturbiineja,released,skill/competence,sector-specific,,"Tehdä kaikki tarvittavat toimet tuuliturbiinien pitämiseksi toimintakunnossa. Voidella liikkuvia osia, kuten vaihteistoja ja laakereita, tarkistaa järjestelmän sisäiset yhteydet ja ratkaista mahdollisesti syntyvät merkittävät ongelmat.
	",http://data.europa.eu/esco/skill/ec0401f1-f690-46be-934b-f6f5611085f5,"huoltaa sähkö-, elektroniikka- ja tarkkuuslaitteita"
KnowledgeSkillCompetence,http://data.europa.eu/esco/skill/b970e437-2f8b-42e3-ae49-6718a0cca44f,veden uudelleenkäyttö,released,knowledge,cross-sector,veden kierrätys,"Periaatteet, jotka koskevat veden uudelleenkäytön prosesseja monimutkaisissa kiertojärjestelmissä.",http://data.europa.eu/esco/isced-f/0732,rakentaminen ja rakennussuunnittelu
KnowledgeSkillCompetence,http://data.europa.eu/esco/skill/b9931096-a9b9-4db4-b210-6fcada68c2ff,koordinoida jätemateriaalilähetyksiä,released,skill/competence,occupation-specific,,"Vaarallisen ja vaarattoman jätteen kuljettamisen järjestäminen asiakkaalta jätteenkäsittelylaitokseen, varastoon tai hävitettäväksi, sekä sen varmistaminen, että kuljetus tapahtuu ympäristölainsäädännön mukaisesti.",http://data.europa.eu/esco/skill/e6eeb84c-ad99-42e2-b883-e6ce338aef59 | http://data.europa.eu/esco/skill/4c3ab565-747c-4db3-8c47-79e8d6f98cf4,suunnitella toimintoja ja tuotantoprosesseja | ottaa käyttöön tapoja kulutuksen kielteisen vaikutuksen vähentämiseksi
KnowledgeSkillCompetence,http://data.europa.eu/esco/skill/ba54cf3c-dd64-48ea-8a9d-ee621a05fb07,arvioida ilmanvaihtojärjestelmien energiankulutus,released,skill/competence,sector-specific,,"Arvioida ilmanvaihtojärjestelmän energian kokonaiskulutus järjestelmän ja rakennuksen sähkönkulutuksen ja lämpöhäviön osalta vuosittain, jotta voidaan valita sopiva konsepti.
	",http://data.europa.eu/esco/skill/f5f15f9c-6334-4728-8dc5-3a20a00dfc37,tehdä laskelmia
KnowledgeSkillCompetence,http://data.europa.eu/esco/skill/ba8b530e-8f6f-4667-b734-3358797c0595,ajoneuvon tyyppihyväksyntä,released,knowledge,sector-specific,,"Prosessi sen varmentamiseksi, että ajoneuvo tai sen järjestelmät ja komponentit täyttävät sovellettavissa ympäristöön liittyvissä, hallinnollisissa ja teknisissä standardeissa ja säännöissä määritetyt vaatimukset.
	",http://data.europa.eu/esco/isced-f/1041,kuljetuspalvelut
KnowledgeSkillCompetence,http://data.europa.eu/esco/skill/bb4f3174-8d64-478b-8d9b-5f37cbf557b7,hallita luonnonsuojelualueiden kävijämääriä,released,skill/competence,sector-specific,,"Ohjata luonnonsuojelualueiden kävijämääriä, jotta voidaan minimoida kävijöiden pitkän aikavälin vaikutus ja varmistaa paikallisten kasvien ja eläinten suojelu ympäristösäädösten mukaisesti.
   ",http://data.europa.eu/esco/skill/15fa3879-ac0e-46e6-ae36-609bae9c19c3,valvoa operatiivisia toimia
KnowledgeSkillCompetence,http://data.europa.eu/esco/skill/bb859329-0cd8-45c0-a09f-48b6dcd9fc1a,suojella puita,released,skill/competence,sector-specific,,"Puiden suojeleminen ottamalla huomioon puiden terveys ja kunto, sekä alueelle tehdyt luonnonsuojelusuunnitelmat. Toimiin kuuluu puiden ja niiden oksien leikkaaminen soveltaen tietoa puun biologiasta.",http://data.europa.eu/esco/skill/8064ae65-5d1b-44e1-9aaf-246a4285a9a6 | http://data.europa.eu/esco/skill/8df12fb1-7f41-4068-8d05-007e8fec8f33,noudattaa ympäristönsuojelulakeja ja -normeja | suojella metsiä
KnowledgeSkillCompetence,http://data.europa.eu/esco/skill/bbfb0e36-807c-492f-bed2-267224ba7bc7,tehdä tutkimusta elintarvikejätteen synnyn ehkäisystä,released,skill/competence,cross-sector,,"Tutkia ja arvioida elintarvikejätteen vähentämiseen ja hallintaan liittyviä menetelmiä, laitteita ja kustannuksia. Seurata kirjattuja mittaustietoja ja määrittää elintarvikejätteen synnyn ehkäisyyn liittyviä parannuskohteita.
	",http://data.europa.eu/esco/skill/7eafec38-621a-4b6e-9298-bfe70ec0b253,tehdä akateemista tutkimusta tai markkinatutkimusta
KnowledgeSkillCompetence,http://data.europa.eu/esco/skill/bc97c755-2174-4d02-adaf-21b8b1863742,sisävesiliikenteen ympäristövaikutukset,released,knowledge,sector-specific,sisävesikuljetusten ympäristövaikutukset,"Alusten toiminnan ekologisten vaikutusten huomioon ottaminen, jotta aluksia voitaisiin käyttää tehokkaasti ja ympäristöystävällisesti. Ymmärrys ympäristönäkökohdista sisävesiväylillä.",http://data.europa.eu/esco/isced-f/0521,ympäristötieteet
KnowledgeSkillCompetence,http://data.europa.eu/esco/skill/bce60ecd-ceee-4dbd-b619-70c9789ec634,testata jäähdytyspiirien tiiviys ja paine,released,skill/competence,occupation-specific,,"Suorittaa järjestelmän painekokeet jäähdytys-, ilmastointi- tai lämpöpumppulaitteille käyttämällä paineistettua kaasua ja tyhjiöpumppua jäähdytyspiirin ja sen osien tiiviyden tarkastamiseksi.
	",http://data.europa.eu/esco/skill/a7065828-10aa-4aba-b7d4-f23a30df5060,"asentaa ja korjata sähkö-, elektroniikka- ja tarkkuuslaitteita"
KnowledgeSkillCompetence,http://data.europa.eu/esco/skill/bd70f004-e1d6-43f0-96f1-59c014a4ea01,koordinoida ympäristöhankkeita,released,skill/competence,cross-sector,,"Yrityksen ympäristönsuojelutoimenpiteiden, kuten saasteiden hallinnan, kierrätyksen, jätehuollon, ympäristöystävällisyyden, luonnonsuojelun ja uusiutuvan energian käytön organisointi ja yhdentäminen.",http://data.europa.eu/esco/skill/4c3ab565-747c-4db3-8c47-79e8d6f98cf4 | http://data.europa.eu/esco/skill/8064ae65-5d1b-44e1-9aaf-246a4285a9a6,ottaa käyttöön tapoja kulutuksen kielteisen vaikutuksen vähentämiseksi | noudattaa ympäristönsuojelulakeja ja -normeja
KnowledgeSkillCompetence,http://data.europa.eu/esco/skill/be973dc1-6aa9-4aed-954c-644affe78639,asentaa tiivistenauhoja,released,skill/competence,cross-sector,,Sisä- ja ulkotilojen välisen ilmanvaihdon estävien tiivistenauhojen asentaminen.,http://data.europa.eu/esco/skill/0edd863d-b02d-4714-a1a2-835d6dd23c55,asentaa eristysmateriaaleja
KnowledgeSkillCompetence,http://data.europa.eu/esco/skill/bed97655-cb0c-4f05-bfd7-9a79d058619d,luonnonsuojeluprojektit,released,knowledge,sector-specific,,"Luonnonvaraisten eläinten ja kasvien suojeluun liittyvät hankkeet, joilla pyritään suojelemaan ja säilyttämään monien sellaisten eläinten ekosysteemejä ja elinympäristöjä, joita kaupungistuminen uhkaa.",http://data.europa.eu/esco/isced-f/0522,elinympäristöt ja luonto
KnowledgeSkillCompetence,http://data.europa.eu/esco/skill/bf9a2403-850d-4dd3-b266-edaabebc8ab0,arvioida rakennusten integroitua suunnittelua,released,skill/competence,sector-specific,,"Mitata suunnitteluehdotusten toimivuutta tavoitteiden avulla. Soveltaa, yhdistää ja arvioida kehittyneitä menetelmiä, jotta voidaan analysoida energiajärjestelmien, arkkitehtuurikonseptin, rakennussuunnittelun, rakennusten käytön, ulkoisten ilmasto-olosuhteiden ja LVI-järjestelmien välistä vuorovaikutusta.
	",http://data.europa.eu/esco/skill/1f2950c0-ef1e-44b4-9a55-125ccd7b78af,analysoida ja arvioida tietoa ja dataa
KnowledgeSkillCompetence,http://data.europa.eu/esco/skill/c0133edf-845a-47bf-968b-bd4a5bd03bbf,käyttää vesiviljelmien lämmitysjärjestelmiä,released,skill/competence,sector-specific,,"Veden lämmitysjärjestelmien ja pumppulaitteiden, kuten sähkölämmittimien, lämmönvaihtimien, lämpöpumppujen ja aurinkoenergialla toimivien sähköpumppujen, käyttäminen tarkoituksenmukaisesti.",http://data.europa.eu/esco/skill/8bf9699c-f964-4e4b-ac3d-55aface09cbc,käyttää energiantuotanto- tai -jakelulaitteita
KnowledgeSkillCompetence,http://data.europa.eu/esco/skill/c0ccbd15-36f3-4515-ae0b-b4062d225ee2,noudattaa kiellettyjä materiaaleja koskevia määräyksiä,released,skill/competence,sector-specific,,"Niiden määräysten noudattaminen, jotka kieltävät raskasmetallien käytön juottamisessa, palonsuoja-aineiden ja ftalaattien käytön muoveissa ja johtojen eristeissä. Esimerkiksi EU:n RoHS-direktiivin ja sähkö- ja elektroniikkaromusta annetun direktiivin sekä Kiinan RoHS-direktiivin noudattaminen.",http://data.europa.eu/esco/skill/35dc2a23-cdc3-4291-930f-927ba2911949,varmistaa lainsäädännön noudattaminen
KnowledgeSkillCompetence,http://data.europa.eu/esco/skill/c1de3963-05eb-4e45-8496-58156a345fb1,siirtää sähkön kysyntää,released,skill/competence,sector-specific,,"Sähköntuotantogeneraattorin väliaikaisen sammuttamisen mahdollistaminen siirtämällä energiatarve muualle. Tavoitteena on rajoittaa kuluttajien sähkökatkoksia sillä välin, kun tiettyä ongelmaa etsitään ja korjataan.",http://data.europa.eu/esco/skill/8bf9699c-f964-4e4b-ac3d-55aface09cbc,käyttää energiantuotanto- tai -jakelulaitteita
KnowledgeSkillCompetence,http://data.europa.eu/esco/skill/c1e0de6d-ec3b-4323-92d4-d1c62df2064a,öljynporauslauttoja koskeva lainsäädäntö,released,knowledge,sector-specific,öljynporauslauttoja koskeva sääntely,Öljynporauslauttoja koskevat lainsäädäntö ja ympäristömääräykset.,http://data.europa.eu/esco/isced-f/0421,oikeustieteet
KnowledgeSkillCompetence,http://data.europa.eu/esco/skill/c214d86e-fbb8-45c0-87d4-f2cefc954057,valita kestävät teknologiat suunnittelussa,released,skill/competence,sector-specific,,"Laatia kokonaisvaltainen suunnitelma, joka sisältää passiivisia toimenpiteitä, joita täydennetään järkevästi aktiivisella teknologialla.
	",http://data.europa.eu/esco/skill/01c03003-516d-43c6-8477-45c472413521 | http://data.europa.eu/esco/skill/62afcfdd-a2a6-4143-bafb-59c77e15a01c,antaa rakennusmateriaaleihin liittyviä neuvoja | antaa tuotteita ja palveluja koskevaa neuvontaa
KnowledgeSkillCompetence,http://data.europa.eu/esco/skill/c291df22-0d6b-4cea-8feb-11c350a33081,valvoa säteilytasoja,released,skill/competence,cross-sector,,"Mittaus- ja testaustekniikoiden ja niihin liittyvien laitteiden käyttäminen säteilytasojen tai radioaktiivisten aineiden määrän määrittämiseksi altistumisen estämiseksi sekä terveys-, turvallisuus- ja ympäristöriskien minimoimiseksi.",http://data.europa.eu/esco/skill/d2d9051a-10e1-41c5-9cfb-bbdc58016176 | http://data.europa.eu/esco/skill/d519fadd-85bf-475f-bf14-c53a0290687d,noudattaa työssään varotoimenpiteitä | seurata ympäristöolosuhteita
KnowledgeSkillCompetence,http://data.europa.eu/esco/skill/c29fed5c-f03b-4389-b110-29b6db00cd01,hävittää muuta kuin ruokajätettä ruokateollisuudessa,released,skill/competence,sector-specific,,Ruokateollisuudessa syntyvän muun kuin ruokajätteen hävittäminen ympäristöystävällisillä tavoilla.,http://data.europa.eu/esco/skill/61d1dab2-6007-4b7c-9380-cd88207fa30f,hävittää vaaratonta jätettä tai romua
KnowledgeSkillCompetence,http://data.europa.eu/esco/skill/c3108ed8-de97-41fc-9ff7-8c028e662734,bioteknologia vesiviljelyssä,released,knowledge,cross-sector,,Bioteknologia ja polymeraasiketjureaktiot kestäviä vesiviljelyn tuotantomenetelmiä koskeviin tutkimuksiin.,http://data.europa.eu/esco/skill/61bef658-d7f9-4759-b1b0-0f9cb3bc581a | http://data.europa.eu/esco/isced-f/0831,biotekniikka | kalatalous
KnowledgeSkillCompetence,http://data.europa.eu/esco/skill/c345ad5f-6b37-4861-98b2-769d819309a0,eläinbiologia,released,knowledge,cross-sector,,"Eläinten rakenne, kehitys ja luokittelu sekä niiden vuorovaikutus ekosysteemiensä kanssa.",http://data.europa.eu/esco/isced-f/0511 | http://data.europa.eu/esco/skill/9433da85-70fa-4a25-8f96-71fa59dd1989,biologia
